{
  "id": "dsh-rules-manager",
  "name": "同步与备份工具（DSH Rules Manager）",
  "packageName": "dsh-rules-manager",
  "description": "为 DSH 提供同步与备份工具能力。英文原始说明：DeepSeek Harness (dsh) rules, commands & skills manager: /rules slash command, settings panel with visual rule editing, command list, user-defined custom commands (with {input} argument support, disable/enable), skill management (view/disable/enable/delete-to-trash), and backup restore. Installable as an official dsh bundle.",
  "searchTerms": [
    "同步与备份工具",
    "DSH Rules Manager",
    "dsh-rules-manager",
    "同步",
    "备份",
    "恢复",
    "实验功能",
    "新功能",
    "dsh",
    "rules",
    "manager"
  ],
  "repositoryUrl": "https://github.com/jilian-dsh/dsh-rules-manager",
  "defaultBranch": "main",
  "manifestPath": "dsh-rules-manager/package.json",
  "installPath": "dsh-rules-manager",
  "updatePolicy": "external-only",
  "commit": "91617e28945cfa6f5dc13ef78f242331434b7436",
  "version": "1.6.0",
  "categories": [
    "experimental"
  ],
  "featured": false,
  "installCount": null,
  "source": {
    "updatedAt": "2026-10-06T12:15:33.000Z",
    "observedAt": "2026-10-06T14:48:24.000Z",
    "provenance": "github-commit"
  },
  "assurance": {
    "discovery": {
      "status": "verified",
      "method": "automated-fixed-source-update-v3",
      "checkedAt": "2026-10-06T14:48:24.000Z",
      "evidenceUrl": "https://github.com/jilian-dsh/dsh-rules-manager/commit/91617e28945cfa6f5dc13ef78f242331434b7436",
      "dshRelease": null,
      "systems": [],
      "profiles": [],
      "summary": "The external-only or non-installable listing metadata was refreshed from a fixed Commit; no installability was inferred."
    },
    "installability": {
      "status": "unknown",
      "method": null,
      "checkedAt": null,
      "evidenceUrl": null,
      "dshRelease": null,
      "systems": [],
      "profiles": [],
      "summary": "The updated fixed Commit was not installed or built by Catalog automation."
    },
    "runtime": {
      "status": "unknown",
      "method": null,
      "checkedAt": null,
      "evidenceUrl": null,
      "dshRelease": null,
      "systems": [],
      "profiles": [],
      "summary": "No DSH runtime acceptance was carried forward after the source changed."
    },
    "securityReview": {
      "status": "unknown",
      "method": null,
      "checkedAt": null,
      "evidenceUrl": null,
      "dshRelease": null,
      "systems": [],
      "profiles": [],
      "summary": "Automated fixed-source review is not an independent security audit."
    }
  },
  "entryIds": [
    "rules-manager",
    "rules-manager-service",
    "rules-manager-client"
  ],
  "status": "blocked",
  "statusReason": "Automatic policy blocked installation: the current fixed source b0bbef35eda3 has no common ancestor with the prior Catalog pin a16fb3834008; independent source history remains external-only. runtime or optional dependencies require a separate supply-chain review runtime source contains the files permission signal",
  "compatibility": {
    "dsh": ">=0.1.0-rc.3 <0.2.0 || >=0.1.1-rc.0 <0.2.0",
    "dshReleases": {
      "rc.7": "unknown",
      "rc.8": "unknown",
      "0.1.1-rc.1": "unknown",
      "0.1.1-rc.2": "unknown",
      "0.1.2-alpha.2": "unknown",
      "0.1.2-alpha.3": "unknown",
      "0.1.2-alpha.4": "unknown",
      "0.1.2-alpha.5": "unknown",
      "0.1.7-rc.2": "unknown",
      "0.2.0-rc.1": "unknown",
      "0.2.0-rc.2": "unknown",
      "0.2.1-alpha.1": "unknown",
      "0.2.1-alpha.2": "unknown",
      "0.2.1-alpha.3": "unknown",
      "0.2.1-alpha.4": "unknown",
      "0.2.1-alpha.5": "unknown",
      "0.2.1-rc.1": "unknown",
      "0.2.1-rc.2": "unknown",
      "0.2.1-rc.3": "unknown",
      "0.2.1-rc.4": "unknown"
    },
    "dshOperations": {
      "rc.7": {
        "install": "unknown",
        "start": "unknown",
        "uninstall": "unknown",
        "rollback": "unknown"
      },
      "rc.8": {
        "install": "unknown",
        "start": "unknown",
        "uninstall": "unknown",
        "rollback": "unknown"
      },
      "0.1.1-rc.1": {
        "install": "unknown",
        "start": "unknown",
        "uninstall": "unknown",
        "rollback": "unknown"
      },
      "0.1.1-rc.2": {
        "install": "unknown",
        "start": "unknown",
        "uninstall": "unknown",
        "rollback": "unknown"
      },
      "0.1.2-alpha.2": {
        "install": "unknown",
        "start": "unknown",
        "uninstall": "unknown",
        "rollback": "unknown"
      },
      "0.1.2-alpha.3": {
        "install": "unknown",
        "start": "unknown",
        "uninstall": "unknown",
        "rollback": "unknown"
      },
      "0.1.2-alpha.4": {
        "install": "unknown",
        "start": "unknown",
        "uninstall": "unknown",
        "rollback": "unknown"
      },
      "0.1.2-alpha.5": {
        "install": "unknown",
        "start": "unknown",
        "uninstall": "unknown",
        "rollback": "unknown"
      },
      "0.1.7-rc.2": {
        "install": "unknown",
        "start": "unknown",
        "uninstall": "unknown",
        "rollback": "unknown"
      },
      "0.2.0-rc.1": {
        "install": "unknown",
        "start": "unknown",
        "uninstall": "unknown",
        "rollback": "unknown"
      },
      "0.2.0-rc.2": {
        "install": "unknown",
        "start": "unknown",
        "uninstall": "unknown",
        "rollback": "unknown"
      },
      "0.2.1-alpha.1": {
        "install": "unknown",
        "start": "unknown",
        "uninstall": "unknown",
        "rollback": "unknown"
      },
      "0.2.1-alpha.2": {
        "install": "unknown",
        "start": "unknown",
        "uninstall": "unknown",
        "rollback": "unknown"
      },
      "0.2.1-alpha.3": {
        "install": "unknown",
        "start": "unknown",
        "uninstall": "unknown",
        "rollback": "unknown"
      },
      "0.2.1-alpha.4": {
        "install": "unknown",
        "start": "unknown",
        "uninstall": "unknown",
        "rollback": "unknown"
      },
      "0.2.1-alpha.5": {
        "install": "unknown",
        "start": "unknown",
        "uninstall": "unknown",
        "rollback": "unknown"
      },
      "0.2.1-rc.1": {
        "install": "unknown",
        "start": "unknown",
        "uninstall": "unknown",
        "rollback": "unknown"
      },
      "0.2.1-rc.2": {
        "install": "unknown",
        "start": "unknown",
        "uninstall": "unknown",
        "rollback": "unknown"
      },
      "0.2.1-rc.3": {
        "install": "unknown",
        "start": "unknown",
        "uninstall": "unknown",
        "rollback": "unknown"
      },
      "0.2.1-rc.4": {
        "install": "unknown",
        "start": "unknown",
        "uninstall": "unknown",
        "rollback": "unknown"
      }
    },
    "node": ">=22",
    "systems": [],
    "profiles": []
  },
  "details": {
    "pluginType": "unknown",
    "installSource": "github",
    "license": "MIT",
    "permissions": {
      "level": "unknown",
      "files": "unknown",
      "network": "unknown",
      "commands": "unknown",
      "credentials": [
        "unknown"
      ]
    },
    "externalDependencies": [
      "dsh-rules-manager-client"
    ],
    "reviewStatus": "automated-scan"
  },
  "risk": {
    "installScripts": [],
    "review": "disconnected-history-external-only"
  }
}
