{
  "id": "dsh-ipcalc",
  "name": "实用工具（DSH IP Calculator）",
  "packageName": "dsh-ipcalc",
  "description": "为 DSH 提供 IPv4 子网计算、CIDR 汇总以及 IPv4/IPv6 解析和规范化工具。",
  "searchTerms": [
    "实用工具",
    "DSH IP Calculator",
    "dsh-ipcalc",
    "工具",
    "能力",
    "工具能力",
    "开发与运行时",
    "开发",
    "调试",
    "运行时",
    "dsh",
    "ipcalc"
  ],
  "repositoryUrl": "https://github.com/TYEclipse/dsh-ipcalc",
  "defaultBranch": "main",
  "manifestPath": "package.json",
  "installPath": null,
  "updatePolicy": null,
  "commit": "7170f615583c42106101ca0dd811f176329773f9",
  "version": "0.2.0",
  "categories": [
    "tools",
    "development"
  ],
  "featured": false,
  "installCount": null,
  "source": {
    "updatedAt": "2026-08-30T21:57:00.000Z",
    "observedAt": "2026-08-30T23:57:05.000Z",
    "provenance": "github-commit"
  },
  "assurance": {
    "discovery": {
      "status": "verified",
      "method": "automated-fixed-source-update-v2",
      "checkedAt": "2026-08-30T23:57:05.000Z",
      "evidenceUrl": "https://github.com/TYEclipse/dsh-ipcalc/commit/7170f615583c42106101ca0dd811f176329773f9",
      "dshRelease": null,
      "systems": [],
      "profiles": [],
      "summary": "The external-only or non-installable listing metadata was refreshed from a verified fixed Commit; no installability was inferred."
    },
    "installability": {
      "status": "unknown",
      "method": null,
      "checkedAt": null,
      "evidenceUrl": null,
      "dshRelease": null,
      "systems": [],
      "profiles": [],
      "summary": "The updated release was not installed or built by Catalog automation."
    },
    "runtime": {
      "status": "unknown",
      "method": null,
      "checkedAt": null,
      "evidenceUrl": null,
      "dshRelease": null,
      "systems": [],
      "profiles": [],
      "summary": "No DSH runtime acceptance was carried forward from the previous plugin version."
    },
    "securityReview": {
      "status": "unknown",
      "method": null,
      "checkedAt": null,
      "evidenceUrl": null,
      "dshRelease": null,
      "systems": [],
      "profiles": [],
      "summary": "Automated fixed-source review is not an independent security audit."
    }
  },
  "entryIds": [
    "ipcalc"
  ],
  "status": "unlisted",
  "statusReason": "DSH_LATEST_THREE_COMPATIBILITY_HOLD: Temporarily unlisted because the Catalog has no compatible result for any of the official latest 3 DSH releases (0.2.1-alpha.1, 0.2.1-alpha.2, 0.2.1-alpha.3). Add an exact compatible dshReleases record at a new fixed Commit; range-only or unknown compatibility is not installable evidence.",
  "compatibility": {
    "dsh": null,
    "dshReleases": {
      "rc.7": "unknown",
      "rc.8": "unknown",
      "0.1.1-rc.1": "unknown",
      "0.1.1-rc.2": "unknown",
      "0.1.2-alpha.3": "unknown",
      "0.1.2-alpha.4": "unknown",
      "0.1.2-alpha.5": "unknown",
      "0.1.2-rc.1": "unknown",
      "0.1.3-alpha.1": "unknown",
      "0.1.3-alpha.2": "unknown",
      "0.1.5-alpha.1": "unknown",
      "0.1.5-alpha.2": "unknown",
      "0.1.5-rc.1": "unknown",
      "0.1.5-rc.2": "unknown",
      "0.1.6-alpha.1": "unknown",
      "0.1.6-alpha.2": "unknown",
      "0.1.7-alpha.1": "unknown",
      "0.1.7-alpha.2": "unknown",
      "0.1.7-rc.1": "unknown",
      "0.1.7-rc.2": "unknown",
      "0.2.0-rc.1": "unknown",
      "0.2.0-rc.2": "unknown",
      "0.2.1-alpha.1": "unknown",
      "0.2.1-alpha.2": "unknown",
      "0.2.1-alpha.3": "unknown"
    },
    "dshOperations": {
      "rc.7": {
        "install": "unknown",
        "start": "unknown",
        "uninstall": "unknown",
        "rollback": "unknown"
      },
      "rc.8": {
        "install": "unknown",
        "start": "unknown",
        "uninstall": "unknown",
        "rollback": "unknown"
      },
      "0.1.1-rc.1": {
        "install": "unknown",
        "start": "unknown",
        "uninstall": "unknown",
        "rollback": "unknown"
      },
      "0.1.1-rc.2": {
        "install": "unknown",
        "start": "unknown",
        "uninstall": "unknown",
        "rollback": "unknown"
      },
      "0.1.2-alpha.2": {
        "install": "unknown",
        "start": "unknown",
        "uninstall": "unknown",
        "rollback": "unknown"
      },
      "0.1.2-alpha.3": {
        "install": "unknown",
        "start": "unknown",
        "uninstall": "unknown",
        "rollback": "unknown"
      },
      "0.1.2-alpha.4": {
        "install": "unknown",
        "start": "unknown",
        "uninstall": "unknown",
        "rollback": "unknown"
      },
      "0.1.2-alpha.5": {
        "install": "unknown",
        "start": "unknown",
        "uninstall": "unknown",
        "rollback": "unknown"
      },
      "0.1.2-rc.1": {
        "install": "unknown",
        "start": "unknown",
        "uninstall": "unknown",
        "rollback": "unknown"
      },
      "0.1.3-alpha.1": {
        "install": "unknown",
        "start": "unknown",
        "uninstall": "unknown",
        "rollback": "unknown"
      },
      "0.1.3-alpha.2": {
        "install": "unknown",
        "start": "unknown",
        "uninstall": "unknown",
        "rollback": "unknown"
      },
      "0.1.5-alpha.1": {
        "install": "unknown",
        "start": "unknown",
        "uninstall": "unknown",
        "rollback": "unknown"
      },
      "0.1.5-alpha.2": {
        "install": "unknown",
        "start": "unknown",
        "uninstall": "unknown",
        "rollback": "unknown"
      },
      "0.1.5-rc.1": {
        "install": "unknown",
        "start": "unknown",
        "uninstall": "unknown",
        "rollback": "unknown"
      },
      "0.1.5-rc.2": {
        "install": "unknown",
        "start": "unknown",
        "uninstall": "unknown",
        "rollback": "unknown"
      },
      "0.1.6-alpha.1": {
        "install": "unknown",
        "start": "unknown",
        "uninstall": "unknown",
        "rollback": "unknown"
      },
      "0.1.6-alpha.2": {
        "install": "unknown",
        "start": "unknown",
        "uninstall": "unknown",
        "rollback": "unknown"
      },
      "0.1.7-alpha.1": {
        "install": "unknown",
        "start": "unknown",
        "uninstall": "unknown",
        "rollback": "unknown"
      },
      "0.1.7-alpha.2": {
        "install": "unknown",
        "start": "unknown",
        "uninstall": "unknown",
        "rollback": "unknown"
      },
      "0.1.7-rc.1": {
        "install": "unknown",
        "start": "unknown",
        "uninstall": "unknown",
        "rollback": "unknown"
      },
      "0.1.7-rc.2": {
        "install": "unknown",
        "start": "unknown",
        "uninstall": "unknown",
        "rollback": "unknown"
      },
      "0.2.0-rc.1": {
        "install": "unknown",
        "start": "unknown",
        "uninstall": "unknown",
        "rollback": "unknown"
      },
      "0.2.0-rc.2": {
        "install": "unknown",
        "start": "unknown",
        "uninstall": "unknown",
        "rollback": "unknown"
      },
      "0.2.1-alpha.1": {
        "install": "unknown",
        "start": "unknown",
        "uninstall": "unknown",
        "rollback": "unknown"
      },
      "0.2.1-alpha.2": {
        "install": "unknown",
        "start": "unknown",
        "uninstall": "unknown",
        "rollback": "unknown"
      },
      "0.2.1-alpha.3": {
        "install": "unknown",
        "start": "unknown",
        "uninstall": "unknown",
        "rollback": "unknown"
      }
    },
    "node": ">=20",
    "systems": [],
    "profiles": []
  },
  "details": {
    "pluginType": "feature",
    "installSource": "github",
    "license": "MIT",
    "permissions": {
      "level": "low",
      "files": "none",
      "network": "none",
      "commands": "none",
      "credentials": [
        "none"
      ]
    },
    "externalDependencies": [],
    "reviewStatus": "automated-scan"
  },
  "risk": {
    "installScripts": [],
    "review": "community-pure-computation-not-security-audited"
  }
}
