{
  "id": "dsh-subagent-model",
  "name": "模型提供商接入（DSH Subagent Model）",
  "packageName": "dsh-subagent-model",
  "description": "为 DSH 提供模型提供商接入能力。英文原始说明：A subagent tool that forces each child onto an explicitly chosen provider/model and reasoning effort instead of inheriting the parent's route",
  "searchTerms": [
    "模型提供商接入",
    "DSH Subagent Model",
    "dsh-subagent-model",
    "模型",
    "LLM",
    "Provider",
    "模型接入",
    "新锐实验",
    "实验功能",
    "新功能",
    "dsh",
    "subagent",
    "model"
  ],
  "repositoryUrl": "https://github.com/dat-lequoc/dsh-subagent-model",
  "defaultBranch": "master",
  "manifestPath": "package.json",
  "installPath": null,
  "updatePolicy": "external-only",
  "commit": "5fe1146d7eab012849c778cbcff81c51a7cc991e",
  "version": "0.1.0",
  "categories": [
    "experimental"
  ],
  "featured": false,
  "installCount": null,
  "source": {
    "updatedAt": "2026-09-25T21:06:05.000Z",
    "observedAt": "2026-09-26T03:57:43.000Z",
    "provenance": "github-commit"
  },
  "assurance": {
    "discovery": {
      "status": "verified",
      "method": "automated-fixed-source-recheck-v1",
      "checkedAt": "2026-09-26T03:57:43.000Z",
      "evidenceUrl": "https://github.com/dat-lequoc/dsh-subagent-model/commit/5fe1146d7eab012849c778cbcff81c51a7cc991e",
      "dshRelease": null,
      "systems": [],
      "profiles": [],
      "summary": "The external-only or non-installable listing metadata was refreshed from a fixed Commit; no installability was inferred."
    },
    "installability": {
      "status": "unknown",
      "method": null,
      "checkedAt": null,
      "evidenceUrl": null,
      "dshRelease": null,
      "systems": [],
      "profiles": [],
      "summary": "The updated fixed Commit was not installed or built by Catalog automation."
    },
    "runtime": {
      "status": "unknown",
      "method": null,
      "checkedAt": null,
      "evidenceUrl": null,
      "dshRelease": null,
      "systems": [],
      "profiles": [],
      "summary": "No DSH runtime acceptance was carried forward after the source changed."
    },
    "securityReview": {
      "status": "unknown",
      "method": null,
      "checkedAt": null,
      "evidenceUrl": null,
      "dshRelease": null,
      "systems": [],
      "profiles": [],
      "summary": "Automated fixed-source review is not an independent security audit."
    }
  },
  "entryIds": [
    "subagent-model-settings"
  ],
  "status": "blocked",
  "statusReason": "Automatic policy blocked installation: manifest repository does not match the canonical GitHub repository; Node.js compatibility is not explicitly declared; runtime source contains the network permission signal; runtime source contains the protectedDsh permission signal",
  "compatibility": {
    "dsh": ">=0.1.0 <0.3.0",
    "dshReleases": {
      "rc.7": "unknown",
      "rc.8": "unknown",
      "0.1.1-rc.1": "unknown",
      "0.1.1-rc.2": "unknown",
      "0.1.2-alpha.2": "unknown",
      "0.1.2-alpha.3": "unknown",
      "0.1.2-alpha.4": "unknown",
      "0.1.2-alpha.5": "unknown",
      "0.1.7-alpha.2": "unknown",
      "0.1.7-rc.1": "unknown",
      "0.1.7-rc.2": "unknown",
      "0.2.0-rc.1": "unknown",
      "0.2.0-rc.2": "unknown",
      "0.2.1-alpha.1": "unknown",
      "0.2.1-alpha.2": "unknown",
      "0.2.1-alpha.3": "unknown",
      "0.2.1-alpha.4": "unknown",
      "0.2.1-alpha.5": "unknown",
      "0.2.1-rc.1": "unknown",
      "0.2.1-rc.2": "unknown",
      "0.2.1-rc.3": "unknown",
      "0.2.1-rc.4": "unknown",
      "0.2.2-alpha.2": "unknown"
    },
    "dshOperations": {
      "rc.7": {
        "install": "unknown",
        "start": "unknown",
        "uninstall": "unknown",
        "rollback": "unknown"
      },
      "rc.8": {
        "install": "unknown",
        "start": "unknown",
        "uninstall": "unknown",
        "rollback": "unknown"
      },
      "0.1.1-rc.1": {
        "install": "unknown",
        "start": "unknown",
        "uninstall": "unknown",
        "rollback": "unknown"
      },
      "0.1.1-rc.2": {
        "install": "unknown",
        "start": "unknown",
        "uninstall": "unknown",
        "rollback": "unknown"
      },
      "0.1.2-alpha.2": {
        "install": "unknown",
        "start": "unknown",
        "uninstall": "unknown",
        "rollback": "unknown"
      },
      "0.1.2-alpha.3": {
        "install": "unknown",
        "start": "unknown",
        "uninstall": "unknown",
        "rollback": "unknown"
      },
      "0.1.2-alpha.4": {
        "install": "unknown",
        "start": "unknown",
        "uninstall": "unknown",
        "rollback": "unknown"
      },
      "0.1.2-alpha.5": {
        "install": "unknown",
        "start": "unknown",
        "uninstall": "unknown",
        "rollback": "unknown"
      },
      "0.1.7-alpha.2": {
        "install": "unknown",
        "start": "unknown",
        "uninstall": "unknown",
        "rollback": "unknown"
      },
      "0.1.7-rc.1": {
        "install": "unknown",
        "start": "unknown",
        "uninstall": "unknown",
        "rollback": "unknown"
      },
      "0.1.7-rc.2": {
        "install": "unknown",
        "start": "unknown",
        "uninstall": "unknown",
        "rollback": "unknown"
      },
      "0.2.0-rc.1": {
        "install": "unknown",
        "start": "unknown",
        "uninstall": "unknown",
        "rollback": "unknown"
      },
      "0.2.0-rc.2": {
        "install": "unknown",
        "start": "unknown",
        "uninstall": "unknown",
        "rollback": "unknown"
      },
      "0.2.1-alpha.1": {
        "install": "unknown",
        "start": "unknown",
        "uninstall": "unknown",
        "rollback": "unknown"
      },
      "0.2.1-alpha.2": {
        "install": "unknown",
        "start": "unknown",
        "uninstall": "unknown",
        "rollback": "unknown"
      },
      "0.2.1-alpha.3": {
        "install": "unknown",
        "start": "unknown",
        "uninstall": "unknown",
        "rollback": "unknown"
      },
      "0.2.1-alpha.4": {
        "install": "unknown",
        "start": "unknown",
        "uninstall": "unknown",
        "rollback": "unknown"
      },
      "0.2.1-alpha.5": {
        "install": "unknown",
        "start": "unknown",
        "uninstall": "unknown",
        "rollback": "unknown"
      },
      "0.2.1-rc.1": {
        "install": "unknown",
        "start": "unknown",
        "uninstall": "unknown",
        "rollback": "unknown"
      },
      "0.2.1-rc.2": {
        "install": "unknown",
        "start": "unknown",
        "uninstall": "unknown",
        "rollback": "unknown"
      },
      "0.2.1-rc.3": {
        "install": "unknown",
        "start": "unknown",
        "uninstall": "unknown",
        "rollback": "unknown"
      },
      "0.2.1-rc.4": {
        "install": "unknown",
        "start": "unknown",
        "uninstall": "unknown",
        "rollback": "unknown"
      },
      "0.2.2-alpha.2": {
        "install": "unknown",
        "start": "unknown",
        "uninstall": "unknown",
        "rollback": "unknown"
      }
    },
    "node": null,
    "systems": [],
    "profiles": [
      "web"
    ]
  },
  "details": {
    "pluginType": "unknown",
    "installSource": "github",
    "license": "MIT",
    "permissions": {
      "level": "unknown",
      "files": "unknown",
      "network": "unknown",
      "commands": "unknown",
      "credentials": [
        "unknown"
      ]
    },
    "externalDependencies": [],
    "reviewStatus": "automated-scan"
  },
  "risk": {
    "installScripts": [],
    "review": "automatic-policy-blocked-not-installable"
  }
}
