{
  "id": "dsh-ios",
  "name": "会话管理（DSH Ios）",
  "packageName": "@zseven-w/dsh-ios",
  "description": "为 DSH 提供会话管理能力。英文原始说明：DeepSeek Harness plugin for the iOS Simulator — build, run, and interact with a live simulator stream inside a conversation. Tested with DSH 0.1.1-rc.1.",
  "searchTerms": [
    "会话管理",
    "DSH Ios",
    "dsh-ios",
    "@zseven-w/dsh-ios",
    "会话",
    "对话",
    "历史",
    "消息",
    "新锐实验",
    "实验功能",
    "新功能",
    "dsh",
    "ios"
  ],
  "repositoryUrl": "https://github.com/Kickstartparty3459/dsh-ios",
  "defaultBranch": "main",
  "manifestPath": "package.json",
  "installPath": null,
  "updatePolicy": "external-only",
  "commit": "dff582267ba8e3b835c224253c701ba2a517a936",
  "version": "0.1.0-rc.3",
  "categories": [
    "experimental"
  ],
  "featured": false,
  "installCount": null,
  "source": {
    "updatedAt": "2026-08-22T18:43:00.000Z",
    "observedAt": "2026-08-22T18:43:54.000Z",
    "provenance": "github-commit"
  },
  "assurance": {
    "discovery": {
      "status": "verified",
      "method": "automated-fixed-source-policy-v1",
      "checkedAt": "2026-08-22T18:43:54.000Z",
      "evidenceUrl": "https://github.com/Kickstartparty3459/dsh-ios/commit/dff582267ba8e3b835c224253c701ba2a517a936",
      "dshRelease": null,
      "systems": [],
      "profiles": [],
      "summary": "Fixed source and Bundle identity were verified; automatic install approval failed closed on one or more policy gates."
    },
    "installability": {
      "status": "unknown",
      "method": null,
      "checkedAt": null,
      "evidenceUrl": null,
      "dshRelease": null,
      "systems": [],
      "profiles": [],
      "summary": "No third-party installation or build code was executed by the automation."
    },
    "runtime": {
      "status": "unknown",
      "method": null,
      "checkedAt": null,
      "evidenceUrl": null,
      "dshRelease": null,
      "systems": [],
      "profiles": [],
      "summary": "No DSH runtime acceptance was inferred from static automation."
    },
    "securityReview": {
      "status": "unknown",
      "method": null,
      "checkedAt": null,
      "evidenceUrl": null,
      "dshRelease": null,
      "systems": [],
      "profiles": [],
      "summary": "Automated source policy is not an independent security audit."
    }
  },
  "entryIds": [
    "dsh-ios"
  ],
  "status": "blocked",
  "statusReason": "Automatic policy blocked installation: manifest repository does not match the canonical GitHub repository; runtime or optional dependencies require a separate supply-chain review; runtime source exceeds the automatic review byte bound",
  "compatibility": {
    "dsh": "^0.1.0-rc.6",
    "dshReleases": {
      "rc.7": "compatible",
      "rc.8": "compatible",
      "0.1.1-rc.1": "compatible",
      "0.1.1-rc.2": "unknown",
      "0.1.2-alpha.3": "unknown",
      "0.1.2-alpha.4": "unknown",
      "0.1.2-alpha.5": "unknown",
      "0.1.2-rc.1": "unknown",
      "0.1.3-alpha.1": "unknown",
      "0.1.3-alpha.2": "unknown",
      "0.1.5-alpha.1": "unknown",
      "0.1.5-alpha.2": "unknown",
      "0.1.5-rc.1": "unknown",
      "0.1.5-rc.2": "unknown",
      "0.1.6-alpha.1": "unknown",
      "0.1.6-alpha.2": "unknown",
      "0.1.7-alpha.1": "unknown",
      "0.1.7-alpha.2": "unknown",
      "0.1.7-rc.1": "unknown",
      "0.1.7-rc.2": "unknown",
      "0.2.0-rc.1": "unknown",
      "0.2.0-rc.2": "unknown",
      "0.2.1-alpha.1": "unknown",
      "0.2.1-alpha.2": "unknown",
      "0.2.1-alpha.3": "unknown",
      "0.2.1-alpha.4": "unknown",
      "0.2.1-alpha.5": "unknown"
    },
    "dshOperations": {
      "rc.7": {
        "install": "unknown",
        "start": "unknown",
        "uninstall": "unknown",
        "rollback": "unknown"
      },
      "rc.8": {
        "install": "unknown",
        "start": "unknown",
        "uninstall": "unknown",
        "rollback": "unknown"
      },
      "0.1.1-rc.1": {
        "install": "unknown",
        "start": "unknown",
        "uninstall": "unknown",
        "rollback": "unknown"
      },
      "0.1.1-rc.2": {
        "install": "unknown",
        "start": "unknown",
        "uninstall": "unknown",
        "rollback": "unknown"
      },
      "0.1.2-alpha.2": {
        "install": "unknown",
        "start": "unknown",
        "uninstall": "unknown",
        "rollback": "unknown"
      },
      "0.1.2-alpha.3": {
        "install": "unknown",
        "start": "unknown",
        "uninstall": "unknown",
        "rollback": "unknown"
      },
      "0.1.2-alpha.4": {
        "install": "unknown",
        "start": "unknown",
        "uninstall": "unknown",
        "rollback": "unknown"
      },
      "0.1.2-alpha.5": {
        "install": "unknown",
        "start": "unknown",
        "uninstall": "unknown",
        "rollback": "unknown"
      },
      "0.1.2-rc.1": {
        "install": "unknown",
        "start": "unknown",
        "uninstall": "unknown",
        "rollback": "unknown"
      },
      "0.1.3-alpha.1": {
        "install": "unknown",
        "start": "unknown",
        "uninstall": "unknown",
        "rollback": "unknown"
      },
      "0.1.3-alpha.2": {
        "install": "unknown",
        "start": "unknown",
        "uninstall": "unknown",
        "rollback": "unknown"
      },
      "0.1.5-alpha.1": {
        "install": "unknown",
        "start": "unknown",
        "uninstall": "unknown",
        "rollback": "unknown"
      },
      "0.1.5-alpha.2": {
        "install": "unknown",
        "start": "unknown",
        "uninstall": "unknown",
        "rollback": "unknown"
      },
      "0.1.5-rc.1": {
        "install": "unknown",
        "start": "unknown",
        "uninstall": "unknown",
        "rollback": "unknown"
      },
      "0.1.5-rc.2": {
        "install": "unknown",
        "start": "unknown",
        "uninstall": "unknown",
        "rollback": "unknown"
      },
      "0.1.6-alpha.1": {
        "install": "unknown",
        "start": "unknown",
        "uninstall": "unknown",
        "rollback": "unknown"
      },
      "0.1.6-alpha.2": {
        "install": "unknown",
        "start": "unknown",
        "uninstall": "unknown",
        "rollback": "unknown"
      },
      "0.1.7-alpha.1": {
        "install": "unknown",
        "start": "unknown",
        "uninstall": "unknown",
        "rollback": "unknown"
      },
      "0.1.7-alpha.2": {
        "install": "unknown",
        "start": "unknown",
        "uninstall": "unknown",
        "rollback": "unknown"
      },
      "0.1.7-rc.1": {
        "install": "unknown",
        "start": "unknown",
        "uninstall": "unknown",
        "rollback": "unknown"
      },
      "0.1.7-rc.2": {
        "install": "unknown",
        "start": "unknown",
        "uninstall": "unknown",
        "rollback": "unknown"
      },
      "0.2.0-rc.1": {
        "install": "unknown",
        "start": "unknown",
        "uninstall": "unknown",
        "rollback": "unknown"
      },
      "0.2.0-rc.2": {
        "install": "unknown",
        "start": "unknown",
        "uninstall": "unknown",
        "rollback": "unknown"
      },
      "0.2.1-alpha.1": {
        "install": "unknown",
        "start": "unknown",
        "uninstall": "unknown",
        "rollback": "unknown"
      },
      "0.2.1-alpha.2": {
        "install": "unknown",
        "start": "unknown",
        "uninstall": "unknown",
        "rollback": "unknown"
      },
      "0.2.1-alpha.3": {
        "install": "unknown",
        "start": "unknown",
        "uninstall": "unknown",
        "rollback": "unknown"
      },
      "0.2.1-alpha.4": {
        "install": "unknown",
        "start": "unknown",
        "uninstall": "unknown",
        "rollback": "unknown"
      },
      "0.2.1-alpha.5": {
        "install": "unknown",
        "start": "unknown",
        "uninstall": "unknown",
        "rollback": "unknown"
      }
    },
    "node": ">=24.11.0",
    "systems": [],
    "profiles": [
      "web"
    ]
  },
  "details": {
    "pluginType": "unknown",
    "installSource": "github",
    "license": "MIT",
    "permissions": {
      "level": "unknown",
      "files": "unknown",
      "network": "unknown",
      "commands": "unknown",
      "credentials": [
        "unknown"
      ]
    },
    "externalDependencies": [
      "serve-sim"
    ],
    "reviewStatus": "automated-scan"
  },
  "risk": {
    "installScripts": [],
    "review": "automatic-policy-blocked-not-installable"
  }
}
