{
  "id": "dsh-tiny-tool",
  "name": "实验功能插件（DSH Tiny Tool）",
  "packageName": "dsh-tiny-tool",
  "description": "为 DSH 提供实验功能插件能力。英文原始说明：Hide all tool/MCP descriptions from the system prompt; expose them on demand via tool_describe",
  "searchTerms": [
    "实验功能插件",
    "DSH Tiny Tool",
    "dsh-tiny-tool",
    "实验功能",
    "新功能",
    "dsh",
    "tiny",
    "tool"
  ],
  "repositoryUrl": "https://github.com/madalee-com/dsh-tiny-tool",
  "defaultBranch": "master",
  "manifestPath": "package.json",
  "installPath": null,
  "updatePolicy": "external-only",
  "commit": "0ae31cc09896f7526e45d3c40dd0822d040d6080",
  "version": "0.7.0",
  "categories": [
    "experimental"
  ],
  "featured": false,
  "installCount": null,
  "source": {
    "updatedAt": "2026-10-06T22:53:22.000Z",
    "observedAt": "2026-10-07T04:47:55.000Z",
    "provenance": "github-commit"
  },
  "assurance": {
    "discovery": {
      "status": "verified",
      "method": "automated-fixed-source-recheck-v1",
      "checkedAt": "2026-10-07T04:47:55.000Z",
      "evidenceUrl": "https://github.com/madalee-com/dsh-tiny-tool/commit/0ae31cc09896f7526e45d3c40dd0822d040d6080",
      "dshRelease": null,
      "systems": [],
      "profiles": [],
      "summary": "The external-only or non-installable listing metadata was refreshed from a fixed Commit; no installability was inferred."
    },
    "installability": {
      "status": "unknown",
      "method": null,
      "checkedAt": null,
      "evidenceUrl": null,
      "dshRelease": null,
      "systems": [],
      "profiles": [],
      "summary": "The updated fixed Commit was not installed or built by Catalog automation."
    },
    "runtime": {
      "status": "unknown",
      "method": null,
      "checkedAt": null,
      "evidenceUrl": null,
      "dshRelease": null,
      "systems": [],
      "profiles": [],
      "summary": "No DSH runtime acceptance was carried forward after the source changed."
    },
    "securityReview": {
      "status": "unknown",
      "method": null,
      "checkedAt": null,
      "evidenceUrl": null,
      "dshRelease": null,
      "systems": [],
      "profiles": [],
      "summary": "Automated fixed-source review is not an independent security audit."
    }
  },
  "entryIds": [
    "dsh-tiny-tool"
  ],
  "status": "blocked",
  "statusReason": "Automatic policy blocked installation: manifest repository does not match the canonical GitHub repository; manifest and GitHub repository license metadata do not match; Node.js compatibility is not explicitly declared; runtime artifact is missing from the distributable surface: ./lib/client.d.ts; fixed-source scan is incomplete; unobserved capability signals are unknown",
  "compatibility": {
    "dsh": "*",
    "dshReleases": {
      "rc.7": "unknown",
      "rc.8": "unknown",
      "0.1.1-rc.1": "unknown",
      "0.1.1-rc.2": "unknown",
      "0.1.2-alpha.2": "unknown",
      "0.1.2-alpha.3": "unknown",
      "0.1.2-alpha.4": "unknown",
      "0.1.2-alpha.5": "unknown",
      "0.2.0-rc.1": "unknown",
      "0.2.0-rc.2": "unknown",
      "0.2.1-alpha.1": "unknown",
      "0.2.1-alpha.2": "unknown",
      "0.2.1-alpha.3": "unknown",
      "0.2.1-alpha.4": "unknown",
      "0.2.1-alpha.5": "unknown",
      "0.2.1-rc.1": "unknown",
      "0.2.1-rc.2": "unknown",
      "0.2.1-rc.3": "unknown",
      "0.2.1-rc.4": "unknown",
      "0.2.2-alpha.2": "unknown",
      "0.2.1-rc.5": "unknown"
    },
    "dshOperations": {
      "rc.7": {
        "install": "unknown",
        "start": "unknown",
        "uninstall": "unknown",
        "rollback": "unknown"
      },
      "rc.8": {
        "install": "unknown",
        "start": "unknown",
        "uninstall": "unknown",
        "rollback": "unknown"
      },
      "0.1.1-rc.1": {
        "install": "unknown",
        "start": "unknown",
        "uninstall": "unknown",
        "rollback": "unknown"
      },
      "0.1.1-rc.2": {
        "install": "unknown",
        "start": "unknown",
        "uninstall": "unknown",
        "rollback": "unknown"
      },
      "0.1.2-alpha.2": {
        "install": "unknown",
        "start": "unknown",
        "uninstall": "unknown",
        "rollback": "unknown"
      },
      "0.1.2-alpha.3": {
        "install": "unknown",
        "start": "unknown",
        "uninstall": "unknown",
        "rollback": "unknown"
      },
      "0.1.2-alpha.4": {
        "install": "unknown",
        "start": "unknown",
        "uninstall": "unknown",
        "rollback": "unknown"
      },
      "0.1.2-alpha.5": {
        "install": "unknown",
        "start": "unknown",
        "uninstall": "unknown",
        "rollback": "unknown"
      },
      "0.2.0-rc.1": {
        "install": "unknown",
        "start": "unknown",
        "uninstall": "unknown",
        "rollback": "unknown"
      },
      "0.2.0-rc.2": {
        "install": "unknown",
        "start": "unknown",
        "uninstall": "unknown",
        "rollback": "unknown"
      },
      "0.2.1-alpha.1": {
        "install": "unknown",
        "start": "unknown",
        "uninstall": "unknown",
        "rollback": "unknown"
      },
      "0.2.1-alpha.2": {
        "install": "unknown",
        "start": "unknown",
        "uninstall": "unknown",
        "rollback": "unknown"
      },
      "0.2.1-alpha.3": {
        "install": "unknown",
        "start": "unknown",
        "uninstall": "unknown",
        "rollback": "unknown"
      },
      "0.2.1-alpha.4": {
        "install": "unknown",
        "start": "unknown",
        "uninstall": "unknown",
        "rollback": "unknown"
      },
      "0.2.1-alpha.5": {
        "install": "unknown",
        "start": "unknown",
        "uninstall": "unknown",
        "rollback": "unknown"
      },
      "0.2.1-rc.1": {
        "install": "unknown",
        "start": "unknown",
        "uninstall": "unknown",
        "rollback": "unknown"
      },
      "0.2.1-rc.2": {
        "install": "unknown",
        "start": "unknown",
        "uninstall": "unknown",
        "rollback": "unknown"
      },
      "0.2.1-rc.3": {
        "install": "unknown",
        "start": "unknown",
        "uninstall": "unknown",
        "rollback": "unknown"
      },
      "0.2.1-rc.4": {
        "install": "unknown",
        "start": "unknown",
        "uninstall": "unknown",
        "rollback": "unknown"
      },
      "0.2.2-alpha.2": {
        "install": "unknown",
        "start": "unknown",
        "uninstall": "unknown",
        "rollback": "unknown"
      },
      "0.2.1-rc.5": {
        "install": "unknown",
        "start": "unknown",
        "uninstall": "unknown",
        "rollback": "unknown"
      }
    },
    "node": null,
    "systems": [],
    "profiles": [
      "web"
    ]
  },
  "details": {
    "pluginType": "unknown",
    "installSource": "github",
    "license": "MIT",
    "permissions": {
      "level": "unknown",
      "files": "unknown",
      "network": "unknown",
      "commands": "unknown",
      "credentials": [
        "unknown"
      ]
    },
    "externalDependencies": [],
    "reviewStatus": "automated-scan"
  },
  "risk": {
    "installScripts": [],
    "review": "automatic-policy-blocked-not-installable"
  }
}
