{
  "id": "dsh-memory-hub",
  "name": "记忆与知识库（DSH Memory Hub）",
  "packageName": "dsh-memory-hub",
  "description": "DSH 记忆中枢：全局记忆包（memory-pack），与 profile 解耦；memory.search / memory.commit / memory.suggest / memory.log / memory.review_status 工具 + 关键词路由 + 确认制提案队列 + BM25 检索 + 审计 + 缓存友好注入（pinned 预算/变更尾部）+ GUI 页签。切包不丢，AI 可检索。",
  "searchTerms": [
    "记忆与知识库",
    "DSH Memory Hub",
    "dsh-memory-hub",
    "记忆",
    "知识库",
    "召回",
    "长期记忆",
    "新锐实验",
    "实验功能",
    "新功能",
    "dsh",
    "memory",
    "hub"
  ],
  "repositoryUrl": "https://github.com/ARFCON/dsh-hotplug-hub",
  "defaultBranch": "main",
  "manifestPath": "dsh-hotplug-hub/dsh-memory-hub/package.json",
  "installPath": "dsh-hotplug-hub/dsh-memory-hub",
  "updatePolicy": "external-only",
  "commit": "7b14257265c131b731bd9989ac77ce368132befc",
  "version": "0.8.0-pre",
  "categories": [
    "experimental"
  ],
  "featured": false,
  "installCount": null,
  "source": {
    "updatedAt": "2026-08-26T05:34:35.000Z",
    "observedAt": "2026-09-07T15:40:28.000Z",
    "provenance": "github-commit"
  },
  "assurance": {
    "discovery": {
      "status": "verified",
      "method": "automated-fixed-source-recheck-v1",
      "checkedAt": "2026-09-07T15:40:28.000Z",
      "evidenceUrl": "https://github.com/ARFCON/dsh-hotplug-hub/commit/7b14257265c131b731bd9989ac77ce368132befc",
      "dshRelease": null,
      "systems": [],
      "profiles": [],
      "summary": "The external-only or non-installable listing metadata was refreshed from a fixed Commit; no installability was inferred."
    },
    "installability": {
      "status": "unknown",
      "method": null,
      "checkedAt": null,
      "evidenceUrl": null,
      "dshRelease": null,
      "systems": [],
      "profiles": [],
      "summary": "The updated fixed Commit was not installed or built by Catalog automation."
    },
    "runtime": {
      "status": "unknown",
      "method": null,
      "checkedAt": null,
      "evidenceUrl": null,
      "dshRelease": null,
      "systems": [],
      "profiles": [],
      "summary": "No DSH runtime acceptance was carried forward after the source changed."
    },
    "securityReview": {
      "status": "unknown",
      "method": null,
      "checkedAt": null,
      "evidenceUrl": null,
      "dshRelease": null,
      "systems": [],
      "profiles": [],
      "summary": "Automated fixed-source review is not an independent security audit."
    }
  },
  "entryIds": [
    "memory-hub"
  ],
  "status": "blocked",
  "statusReason": "Automatic policy blocked installation: manifest repository does not match the canonical GitHub repository; DSH compatibility is not explicitly declared; runtime source contains the files permission signal; runtime source contains the network permission signal; runtime source contains the credentials permission signal",
  "compatibility": {
    "dsh": null,
    "dshReleases": {
      "rc.7": "unknown",
      "rc.8": "unknown",
      "0.1.1-rc.1": "unknown",
      "0.1.1-rc.2": "unknown",
      "0.1.2-alpha.2": "unknown",
      "0.1.2-alpha.3": "unknown",
      "0.1.2-alpha.4": "unknown",
      "0.1.2-alpha.5": "unknown",
      "0.1.2-rc.1": "unknown",
      "0.1.3-alpha.1": "unknown",
      "0.1.3-alpha.2": "unknown",
      "0.1.5-alpha.1": "unknown",
      "0.1.5-alpha.2": "unknown",
      "0.1.5-rc.1": "unknown",
      "0.1.5-rc.2": "unknown",
      "0.1.6-alpha.1": "unknown",
      "0.1.6-alpha.2": "unknown",
      "0.1.7-alpha.1": "unknown",
      "0.1.7-alpha.2": "unknown",
      "0.1.7-rc.1": "unknown",
      "0.1.7-rc.2": "unknown",
      "0.2.0-rc.1": "unknown",
      "0.2.0-rc.2": "unknown",
      "0.2.1-alpha.1": "unknown",
      "0.2.1-alpha.2": "unknown",
      "0.2.1-alpha.3": "unknown",
      "0.2.1-alpha.4": "unknown",
      "0.2.1-alpha.5": "unknown",
      "0.2.1-rc.1": "unknown",
      "0.2.1-rc.2": "unknown",
      "0.2.1-rc.3": "unknown",
      "0.2.1-rc.4": "unknown",
      "0.2.2-alpha.2": "unknown",
      "0.2.1-rc.5": "unknown"
    },
    "dshOperations": {
      "rc.7": {
        "install": "unknown",
        "start": "unknown",
        "uninstall": "unknown",
        "rollback": "unknown"
      },
      "rc.8": {
        "install": "unknown",
        "start": "unknown",
        "uninstall": "unknown",
        "rollback": "unknown"
      },
      "0.1.1-rc.1": {
        "install": "unknown",
        "start": "unknown",
        "uninstall": "unknown",
        "rollback": "unknown"
      },
      "0.1.1-rc.2": {
        "install": "unknown",
        "start": "unknown",
        "uninstall": "unknown",
        "rollback": "unknown"
      },
      "0.1.2-alpha.2": {
        "install": "unknown",
        "start": "unknown",
        "uninstall": "unknown",
        "rollback": "unknown"
      },
      "0.1.2-alpha.3": {
        "install": "unknown",
        "start": "unknown",
        "uninstall": "unknown",
        "rollback": "unknown"
      },
      "0.1.2-alpha.4": {
        "install": "unknown",
        "start": "unknown",
        "uninstall": "unknown",
        "rollback": "unknown"
      },
      "0.1.2-alpha.5": {
        "install": "unknown",
        "start": "unknown",
        "uninstall": "unknown",
        "rollback": "unknown"
      },
      "0.1.2-rc.1": {
        "install": "unknown",
        "start": "unknown",
        "uninstall": "unknown",
        "rollback": "unknown"
      },
      "0.1.3-alpha.1": {
        "install": "unknown",
        "start": "unknown",
        "uninstall": "unknown",
        "rollback": "unknown"
      },
      "0.1.3-alpha.2": {
        "install": "unknown",
        "start": "unknown",
        "uninstall": "unknown",
        "rollback": "unknown"
      },
      "0.1.5-alpha.1": {
        "install": "unknown",
        "start": "unknown",
        "uninstall": "unknown",
        "rollback": "unknown"
      },
      "0.1.5-alpha.2": {
        "install": "unknown",
        "start": "unknown",
        "uninstall": "unknown",
        "rollback": "unknown"
      },
      "0.1.5-rc.1": {
        "install": "unknown",
        "start": "unknown",
        "uninstall": "unknown",
        "rollback": "unknown"
      },
      "0.1.5-rc.2": {
        "install": "unknown",
        "start": "unknown",
        "uninstall": "unknown",
        "rollback": "unknown"
      },
      "0.1.6-alpha.1": {
        "install": "unknown",
        "start": "unknown",
        "uninstall": "unknown",
        "rollback": "unknown"
      },
      "0.1.6-alpha.2": {
        "install": "unknown",
        "start": "unknown",
        "uninstall": "unknown",
        "rollback": "unknown"
      },
      "0.1.7-alpha.1": {
        "install": "unknown",
        "start": "unknown",
        "uninstall": "unknown",
        "rollback": "unknown"
      },
      "0.1.7-alpha.2": {
        "install": "unknown",
        "start": "unknown",
        "uninstall": "unknown",
        "rollback": "unknown"
      },
      "0.1.7-rc.1": {
        "install": "unknown",
        "start": "unknown",
        "uninstall": "unknown",
        "rollback": "unknown"
      },
      "0.1.7-rc.2": {
        "install": "unknown",
        "start": "unknown",
        "uninstall": "unknown",
        "rollback": "unknown"
      },
      "0.2.0-rc.1": {
        "install": "unknown",
        "start": "unknown",
        "uninstall": "unknown",
        "rollback": "unknown"
      },
      "0.2.0-rc.2": {
        "install": "unknown",
        "start": "unknown",
        "uninstall": "unknown",
        "rollback": "unknown"
      },
      "0.2.1-alpha.1": {
        "install": "unknown",
        "start": "unknown",
        "uninstall": "unknown",
        "rollback": "unknown"
      },
      "0.2.1-alpha.2": {
        "install": "unknown",
        "start": "unknown",
        "uninstall": "unknown",
        "rollback": "unknown"
      },
      "0.2.1-alpha.3": {
        "install": "unknown",
        "start": "unknown",
        "uninstall": "unknown",
        "rollback": "unknown"
      },
      "0.2.1-alpha.4": {
        "install": "unknown",
        "start": "unknown",
        "uninstall": "unknown",
        "rollback": "unknown"
      },
      "0.2.1-alpha.5": {
        "install": "unknown",
        "start": "unknown",
        "uninstall": "unknown",
        "rollback": "unknown"
      },
      "0.2.1-rc.1": {
        "install": "unknown",
        "start": "unknown",
        "uninstall": "unknown",
        "rollback": "unknown"
      },
      "0.2.1-rc.2": {
        "install": "unknown",
        "start": "unknown",
        "uninstall": "unknown",
        "rollback": "unknown"
      },
      "0.2.1-rc.3": {
        "install": "unknown",
        "start": "unknown",
        "uninstall": "unknown",
        "rollback": "unknown"
      },
      "0.2.1-rc.4": {
        "install": "unknown",
        "start": "unknown",
        "uninstall": "unknown",
        "rollback": "unknown"
      },
      "0.2.2-alpha.2": {
        "install": "unknown",
        "start": "unknown",
        "uninstall": "unknown",
        "rollback": "unknown"
      },
      "0.2.1-rc.5": {
        "install": "unknown",
        "start": "unknown",
        "uninstall": "unknown",
        "rollback": "unknown"
      }
    },
    "node": ">=22.0.0",
    "systems": [],
    "profiles": [
      "web"
    ]
  },
  "details": {
    "pluginType": "unknown",
    "installSource": "github",
    "license": "MIT",
    "permissions": {
      "level": "unknown",
      "files": "unknown",
      "network": "unknown",
      "commands": "unknown",
      "credentials": [
        "unknown"
      ]
    },
    "externalDependencies": [],
    "reviewStatus": "automated-scan"
  },
  "risk": {
    "installScripts": [],
    "review": "automatic-policy-blocked-not-installable"
  }
}
